{
  "$schema": "https://json-schema.org/draft/2020-12/schema",
  "$id": "character.schema.json",
  "title": "Dialogue Character",
  "type": "object",
  "additionalProperties": false,
  "required": [
    "schemaVersion",
    "id",
    "languageId",
    "name",
    "origin",
    "gender",
    "ageBand",
    "voiceProfile"
  ],
  "properties": {
    "schemaVersion": {
      "type": "string"
    },
    "id": {
      "type": "string",
      "minLength": 1
    },
    "languageId": {
      "type": "string",
      "minLength": 1
    },
    "name": {
      "type": "string",
      "minLength": 1
    },
    "origin": {
      "enum": [
        "source",
        "app_created"
      ]
    },
    "sourceRefs": {
      "type": "array",
      "items": {
        "type": "string"
      },
      "uniqueItems": true,
      "default": []
    },
    "gender": {
      "enum": [
        "female",
        "male",
        "unspecified",
        "not_applicable"
      ]
    },
    "ageBand": {
      "enum": [
        "child",
        "teen",
        "young_adult",
        "adult",
        "middle_aged",
        "older_adult",
        "unspecified"
      ]
    },
    "roles": {
      "type": "array",
      "items": {
        "type": "string"
      },
      "uniqueItems": true,
      "default": []
    },
    "relationshipTags": {
      "type": "array",
      "items": {
        "type": "string"
      },
      "uniqueItems": true,
      "default": []
    },
    "contextNotes": {
      "type": "string"
    },
    "voiceProfile": {
      "type": "object",
      "additionalProperties": false,
      "required": [
        "clarity",
        "stressLevel",
        "aggressiveness",
        "toneConsistency",
        "elevenLabsVoiceId"
      ],
      "properties": {
        "clarity": {
          "const": "high"
        },
        "stressLevel": {
          "enum": [
            "low",
            "very_low"
          ]
        },
        "aggressiveness": {
          "const": "none"
        },
        "toneConsistency": {
          "enum": [
            "high",
            "medium_high"
          ]
        },
        "ageImpression": {
          "type": [
            "string",
            "null"
          ],
          "enum": [
            "child",
            "teen",
            "young_adult",
            "adult",
            "middle_aged",
            "older_adult",
            "neutral",
            null
          ]
        },
        "genderImpression": {
          "type": [
            "string",
            "null"
          ],
          "enum": [
            "female",
            "male",
            "neutral",
            null
          ]
        },
        "elevenLabsVoiceId": {
          "type": [
            "string",
            "null"
          ],
          "default": null
        },
        "voiceName": {
          "type": [
            "string",
            "null"
          ],
          "default": null
        }
      }
    },
    "relationships": {
      "type": "array",
      "items": {
        "type": "object",
        "additionalProperties": false,
        "required": [
          "characterId",
          "type"
        ],
        "properties": {
          "characterId": {
            "type": "string",
            "minLength": 1
          },
          "type": {
            "enum": [
              "friend",
              "classmate",
              "neighbor",
              "acquaintance",
              "coworker",
              "family",
              "service_context"
            ]
          },
          "contextNotes": {
            "type": "string"
          }
        }
      },
      "uniqueItems": true,
      "default": []
    }
  }
}
