{
  "schemaVersion":"1.0.0",
  "id":"char-de-paul",
  "languageId":"de",
  "name":"Paul Müller",
  "origin":"app_created",
  "gender":"male",
  "ageBand":"young_adult",
  "roles":["conversation_partner"],
  "relationshipTags":["acquaintance","family"],
  "relationships":[
    {"characterId":"char-de-iris","type":"acquaintance","contextNotes":"پاول و آیریس در یک آشنایی مؤدبانه با هم آشنا شده‌اند."},
    {"characterId":"char-de-mia","type":"family","contextNotes":"پاول و میا خواهر و برادرند و در واحد خانواده می‌توانند دربارهٔ اعضای مشترک خانواده پاسخ بدهند."}
  ],
  "contextNotes":"پاول مولر ۲۰ ساله است و در محتوای فعلی در اتریش زندگی می‌کند. زبان‌آموز در مرور اطلاعات شخصی نقش پاول را بازی می‌کند. در واحد خانواده، میا خواهر اوست و هر دو دربارهٔ برادر کوچک‌تر مشترکشان پاسخ می‌دهند.",
  "voiceProfile":{"clarity":"high","stressLevel":"very_low","aggressiveness":"none","toneConsistency":"high","ageImpression":"young_adult","genderImpression":"male","elevenLabsVoiceId":null,"voiceName":null}
}
